URL,Title,Description
https://www.coursera.org/learn/ml-models-human-in-the-loop-pipelines?specialization=practical-data-science,optimize ml models and deploy human-in-the-loop pipelines,"data science machine learning human-in-the-loop pipelines,distributed model training and hyperparameter tuning,cost savings and performance improvements,a/b testing and model deployment,data labeling at scale,"
https://www.coursera.org/learn/artificial-creativity?specialization=creativity-ai,artificial creativity,"computer science design and product artificial intelligence (ai),machine learning,design thinking,business applications,computational creativity,"
https://www.coursera.org/learn/forex-trading?specialization=financial-instruments-trading-investing,forex - trading around the world,"business finance fx case study,fx trading,currency pairs,foreign exchange market (forex),monetary policy,"
https://www.coursera.org/learn/leadership-skills?specialization=inspirational-leadership,building your leadership skills,"business leadership and management confidence,communication,leadership,human resources (hr),"
https://www.coursera.org/learn/aws-cloud-technical-essentials?specialization=aws-fundamentals,aws cloud technical essentials,"information technology cloud computing aws identity and access management,networking on aws,aws management console,cloud computing,aws security,"
https://www.coursera.org/learn/algorithms-divide-conquer?specialization=algorithms,"divide and conquer, sorting and searching, and randomized algorithms","computer science algorithms algorithms,randomized algorithm,sorting algorithm,divide and conquer algorithms,"
https://www.coursera.org/learn/aromatherapy-clinical-use-essential-oils?specialization=integrative-health-and-medicine,aromatherapy: clinical use of essential oils,"health research integrative healthcare,wellbeing,patient-centered care,improved symptom management,evidence-based practice,"
https://www.coursera.org/learn/diseno-de-proyectos-de-desarrollo?specialization=especializacion-en-diseno-y-gestion-de-proyectos-de-desarrollo,diseño de proyectos de desarrollo,"social sciences governance and society sostenbilidad,gestión de proyectos,diseño de proyectos,planificación estratégica,evaluación de necesidades,"
https://www.coursera.org/learn/open-source-tools-for-data-science?specialization=data-science-fundamentals-python-sql,tools for data science,"data science data analysis data science,github,python programming,jupyter notebooks,rstudio,"
https://www.coursera.org/learn/linux-system-administration-ibm-power-systems?specialization=linux-private-cloud-administration-power-systems,linux system administration with ibm power systems,"information technology cloud computing linux,red hat enterprise linux,virtualization,ibm power systems,cloud computing,"
https://www.coursera.org/learn/gcp-fundamentals?specialization=google-cloud-database-engineer,google cloud fundamentals: core infrastructure,"information technology cloud computing google compute engine,google app engine (gae),google cloud platform,cloud computing,"
https://www.coursera.org/learn/human-resources-management-capstone?specialization=human-resource-management,human resources management capstone: hr for people managers,"business leadership and management human resources (hr),compensation analysis,performance management,"
https://www.coursera.org/learn/sensor-manufacturing-process-control?specialization=embedding-sensors-motors,sensor manufacturing and process control,"physical science and engineering electrical engineering sensor manufacturing,pid control,mems hardware,mems sensors,process control,"
https://www.coursera.org/learn/ml-regression?specialization=machine-learning,machine learning: regression,"data science machine learning linear regression,ridge regression,lasso (statistics),regression analysis,"
https://www.coursera.org/learn/gender-analytics-inclusive-analytics?specialization=gender-analytics,inclusive analytic techniques,"business business essentials business analytics,gender based analysis,qualitative and quantitative data analysis,stakeholder analysis,community engagement,"
https://www.coursera.org/learn/fusion-360-integrated-cad-cam-cae?specialization=cad-design-digital-manufacturing,autodesk fusion 360 integrated cad/cam/cae,"physical science and engineering mechanical engineering computer-aided design (cad),autodesk,3d modeling,autocad,"
https://www.coursera.org/learn/data-wrangling-analysis-abtesting?specialization=learn-sql-basics-data-science,"data wrangling, analysis and ab testing with sql","data science data analysis a/b testing,query string,data analysis,predictive analytics,sql,"
https://www.coursera.org/learn/execution-persistence-privilege-escalation-and-evasion?specialization=pythonforcybersecurity,"execution, persistence, privilege escalation and evasion","information technology security persistence,python programming,privilege escalation and evasion,cybersecurity,execution,"
https://www.coursera.org/learn/financial-statements?specialization=accounting-fundamentals,understanding financial statements: company position,"business business essentials accounting,financial statement,balance sheet,accounting terminology,"
https://www.coursera.org/learn/excel-power-tools?specialization=excel-data-analytics-visualization,excel power tools for data analysis,"business business essentials microsoft excel,data analysis,big data,data visualization (dataviz),power bi,"
https://www.coursera.org/learn/introduction-software-testing?specialization=software-testing-automation,introduction to software testing,"computer science software development writing test plans,writing defect reports,understanding of testing theory,writing tests,testing vocabulary,"
https://www.coursera.org/learn/everyday-excel-part-1?specialization=everyday-excel,"everyday excel, part 1","computer science design and product data management,spreadsheet,microsoft excel,problem solving,real world,"
https://www.coursera.org/learn/designing-organization?specialization=business-value-project-management,designing the organization,"business leadership and management organizational structure,knowledge of general business functions,organization design,organizational theory,strategic management,"
https://www.coursera.org/learn/developing-a-google-sre-culture?specialization=organizational-change-and-culture-for-adopting-google-cloud,developing a google sre culture,"business leadership and management sre culture,business value,organizational culture,"
https://www.coursera.org/learn/project-management-capstone?specialization=project-management,project management project,"business business essentials schedule,project management,risk management,budget,"
https://www.coursera.org/learn/wharton-entrepreneurship-financing-profitabilty?specialization=wharton-entrepreneurship,entrepreneurship 4: financing and profitability,"business entrepreneurship venture capital,exit strategy,finance,entrepreneurship,"
https://www.coursera.org/learn/custom-models-layers-loss-functions-with-tensorflow?specialization=tensorflow-advanced-techniques,"custom models, layers, and loss functions with tensorflow","data science machine learning functional api,custom layers,custom and exotic models with functional api,custom loss functions,"
https://www.coursera.org/learn/ai?specialization=advanced-data-science-ibm,applied ai with deeplearning,"data science machine learning machine learning,deep learning,long short-term memory (istm),apache spark,"
https://www.coursera.org/learn/a-technical-leaders-qualities-and-effectiveness?specialization=principles-of-leadership-leading-technical-teams,a technical leader's qualities and effectiveness,"personal development personal development collaboration,managing stakeholders,resilience,relationships,negotiation,"
https://www.coursera.org/learn/biostatistics-2?specialization=advanced-statistics-data-science,mathematical biostatistics boot camp 2,"data science probability and statistics statistics,statistical hypothesis testing,biostatistics,"
https://www.coursera.org/learn/build-better-generative-adversarial-networks-gans?specialization=generative-adversarial-networks-gans,build better generative adversarial networks (gans),"data science machine learning bias in gans,stylegans,pros and cons of gans,gans alternatives,gan evaluation,"
https://www.coursera.org/learn/ml-classification?specialization=machine-learning,machine learning: classification,"data science machine learning logistic regression,statistical classification,classification algorithms,decision tree,"
https://www.coursera.org/learn/leading-teams-building-effective-team-cultures?specialization=strategic-leadership,leading teams: building effective team cultures,"business leadership and management develop team culture,navigate growth and change in teams,create space for deib,facilitate psychological safety,manage motivation and engagement,"
https://www.coursera.org/learn/career-fitness?specialization=career-brand-management,career self-management advanced certification,"personal development personal development skills management,strategy,personal development,personal branding,competence (human resources),"
https://www.coursera.org/learn/brand-new-brand?specialization=graphic-design,brand new brand,"arts and humanities music and art adobe photoshop,adobe indesign,graphics,color theory,"
https://www.coursera.org/learn/managing-organization?specialization=business-value-project-management,managing the organization,"business leadership and management organizational culture,ethics,decision-making,strategic leadership,organizational change,"
https://www.coursera.org/learn/critical-thinking-skills-for-professionals?specialization=professional-skills-for-the-workplace,critical thinking skills for the professional,"business business essentials critical thinking,decision-making,problem solving,brainstorming,"
https://www.coursera.org/learn/social-media-digital-marketing-fundamentals?specialization=social-media-marketing-practice,social media and digital marketing fundamentals,"business marketing digital transformation,digital marketing,social media marketing,content marketing,digital strategy,"
https://www.coursera.org/learn/scala-functional-programming?specialization=scala,functional programming principles in scala,"computer science software development scala programming,recursion,functional programming,immutable data types,higher-order function,"
https://www.coursera.org/learn/introduction-to-cloud?specialization=it-cloud-fundamentals,introduction to cloud computing,"information technology cloud computing cloud native,devops,iaas paas saas,hybrid multicloud,cloud computing,"
https://www.coursera.org/learn/patient-safety-measurement?specialization=patient-safety,measuring the success of a patient safety or quality improvement project (patient safety vi),"health healthcare management data analysis,performance measurement,project evaluation,"
https://www.coursera.org/learn/financial-accounting-advanced?specialization=business-data-management-communication,financial accounting: advanced topics,"business finance cash flow,financial accounting,cash flow statement,financial statement,"
https://www.coursera.org/learn/immunology-immune-system-and-infectious-diseases?specialization=immunology-the-immune-system-and-its-failures,immunology: immune system and infectious diseases,"health basic science immunology,tumour immunity,autoimmunity,infectious diseases,"
https://www.coursera.org/learn/publicspeakingandpresentations?specialization=communicationforeveryone,public speaking and presentations ,"personal development personal development responding with an elevator pitch,preparing an informative lecture,delivering a persuasive speech,engaging others with storytelling,"
https://www.coursera.org/learn/uva-darden-design-thinking-innovation?specialization=leading-modern-day-business,design thinking for innovation,"business business strategy strategic thinking,design thinking,innovation management,design management,innovation,"
https://www.coursera.org/learn/supervised-machine-learning-classification?specialization=ibm-intro-machine-learning, supervised machine learning: classification,"data science machine learning decision tree,ensemble learning,classification algorithms,supervised learning,machine learning (ml) algorithms,"
https://www.coursera.org/learn/powerpoint-presentations?specialization=pwc-analytics,effective business presentations with powerpoint,"business business essentials data analysis,communication,presentation design,presentation,"
https://www.coursera.org/learn/python-project-for-data-science?specialization=data-science-fundamentals-python-sql,python project for data science,"data science data analysis data science,python programming,data analysis,pandas,jupyter notebooks,"
https://www.coursera.org/learn/introduction-to-management-consulting?specialization=managementconsulting,introduction to management consulting,"business business strategy business case,business analytics,management consulting,problem solving,consulting,"
https://www.coursera.org/learn/firm-level-economics?specialization=managerial-economics-business-analysis,firm level economics: consumer and producer behavior,"business finance economics,consumer behaviour,supply and demand,cost,"
https://www.coursera.org/learn/designing-organization?specialization=strategic-leadership,designing the organization,"business leadership and management organizational structure,knowledge of general business functions,organization design,organizational theory,strategic management,"
https://www.coursera.org/learn/python-programming-intro?specialization=programming-python-java,introduction to python programming,"computer science software development python tools,python syntax and semantics,programming principles,python programming,computer programming,"
https://www.coursera.org/learn/image-segmentation?specialization=image-processing,"image segmentation, filtering, and region analysis","physical science and engineering electrical engineering image processing,image segmentation,region analysis,image filtering,"
https://www.coursera.org/learn/build-data-science-team?specialization=executive-data-science,building a data science team,"data science data analysis team building,data science,management,team management,"
https://www.coursera.org/learn/excel-vba-for-creative-problem-solving-part-1?specialization=excel-vba-creative-problem-solving,"excel/vba for creative problem solving, part 1","computer science algorithms microsoft excel vba,computer programming,problem solving,debugging,"
https://www.coursera.org/learn/art-of-negotiation?specialization=career-success,the art of negotiation,"business business essentials win-win game,negotiation,planning,principled negotiation,"
https://www.coursera.org/learn/positive-psychology-project?specialization=positivepsychology,positive psychology specialization project: design your life for well-being,"health psychology character strengths and virtues,flourishing,positive psychology,personal development,"
https://www.coursera.org/learn/project-risk-management?specialization=project-management-success,managing project risks and changes,"business leadership and management project management,change control,risk management,change management,"
https://www.coursera.org/learn/renewable-energy-projects?specialization=renewable-energy,renewable energy projects,"physical science and engineering environmental science and sustainability renewable energy,project execution,project operations,project feasibility,project management,"
https://www.coursera.org/learn/multiple-regression-analysis-public-health?specialization=biostatistics-public-health,multiple regression analysis in public health ,"health health informatics effect modifcation,proportional hazards model,regression analysis,spline approach,"
https://www.coursera.org/learn/exploratory-data-analysis?specialization=data-science-foundations-r,exploratory data analysis,"data science data analysis cluster analysis,ggplot2,r programming,exploratory data analysis,"
https://www.coursera.org/learn/decision-making-art-and-science?specialization=strategic-leadership-impact-change-decision-making,decision-making: blending art & science,"business leadership and management decision-making,management,strategic leadership,learning how to learn,leadership development,"
https://www.coursera.org/learn/django-build-web-apps?specialization=django,building web applications in django,"computer science mobile and web development django template language,get & post,object-oriented programming (oop),cross-site scripting forgery (csrf),django (web framework),"
https://www.coursera.org/learn/wharton-operations-analytics?specialization=business-analytics,operations analytics,"business business strategy simulation,mathematical optimization,solver,decision tree,"
https://www.coursera.org/learn/java-programming-recommender?specialization=java-programming,java programming: build a recommendation system,"computer science software development data structure,interfaces,software design,java programming,"
https://www.coursera.org/learn/healthcare-organizations-health-system?specialization=healthcare-organization-operations,healthcare organizations and the health system,"health healthcare management pharmacy healthcare organization operations,public health and wellness healthcare organization operations,medical healthcare organization operations,healthcare administration,dental healthcare organization operations,"
https://www.coursera.org/learn/introduction-supply-chain-finance-blockchain-technology?specialization=supply-chain-finance-and-blockchain-technology,introduction to supply chain finance & blockchain technology,"business business strategy blockchain technology implementation,foreign currency risk management,accounts receivable management,accounts payable management,trade finance management,"
https://www.coursera.org/learn/rpa-basics-and-introduction-to-uipath?specialization=roboticprocessautomation,rpa basics and introduction to uipath,"computer science software development uipath,studio,automation,workflow,rpa,"
https://www.coursera.org/learn/symptom-management-in-palliative-care?specialization=palliative-care-always,symptom management in palliative care,"health patient care symptom management,communication,patient-centered care,symptom assessment,"
https://www.coursera.org/learn/user-research?specialization=interaction-design,user experience: research & prototyping,"computer science design and product user research,persona (user experience),user experience (ux),human–computer interaction,"
https://www.coursera.org/learn/executive-data-science-capstone?specialization=executive-data-science,executive data science capstone,"business leadership and management data science,data analysis,management,data management,"
https://www.coursera.org/learn/data-science-methodology?specialization=introduction-data-science,data science methodology,"data science data analysis data science,methodology,crisp-dm,data analysis,data mining,"
https://www.coursera.org/learn/risk-management-in-personal-finance?specialization=personal-finance-fundamentals,risk management in personal finance,"personal development personal development estate planning,risk management,life insurance,health insurance,insurance,"
https://www.coursera.org/learn/fashion-retail-transformation?specialization=transforming-fashion-business,fashion retail transformation,"business business strategy merchandising,omnichannel processes,customer journey mapping,retail strategy,e-commerce,"
https://www.coursera.org/learn/leading-change-health-informatics?specialization=health-informatics,leading change in health informatics,"health health informatics digital health,information technology planning,health informatics,strategic leadership,health care,"
https://www.coursera.org/learn/apache-spark-sql-for-data-analysts?specialization=data-science-with-databricks-for-data-analysts,apache spark (tm) sql for data analysts,"data science data analysis data analysis,spark sql,sql,"
https://www.coursera.org/learn/financial-forecasting-and-reporting?specialization=finance-for-technical-managers,financial forecasting and reporting,"business leadership and management risk management: scenario and sensitivity analysis,sustainability reporting & esg metrics,budgeting techniques for cost and profit centers,financial ratio analyses & forecasting techniques,understanding corporate financial statements,"
https://www.coursera.org/learn/organization-design?specialization=competitive-strategy,strategic organization design,"business business strategy organization design,strategic management,business strategy,organizational structure,"
https://www.coursera.org/learn/principles-of-computing-1?specialization=computer-fundamentals,principles of computing (part 1),"computer science software development computer programming,algorithms,python programming,combinatorics,"
https://www.coursera.org/learn/trading-strategies-reinforcement-learning?specialization=machine-learning-trading,reinforcement learning for trading strategies,"data science machine learning reinforcement learning model development,reinforcement learning trading algorithm optimization,reinforcement learning trading strategy development,reinforcement learning trading algo development,"
https://www.coursera.org/learn/strategic-management?specialization=strategic-management,strategic management,"business business strategy strategic management,strategic thinking,strategic planning,business strategy,"
https://www.coursera.org/learn/sustainable-consumption-health?specialization=healthy-sustainable-foods-products,sustainable consumption and health,"health public health problem solving,performance,disease,flow network,"
https://www.coursera.org/learn/teaching-early-home-based-childhood?specialization=home-based-child-care,introduction to early childhood,"social sciences education creativity,child care,decision-making,communication,planning & instruction,"
https://www.coursera.org/learn/python-data?specialization=python,python data structures,"computer science software development python syntax and semantics,data structure,tuple,python programming,"
https://www.coursera.org/learn/construction-project-management?specialization=construction-management,construction project management,"business business strategy project management,construction management,work breakdown structure,project planning,"
https://www.coursera.org/learn/machine-learning-data-lifecycle-in-production?specialization=machine-learning-engineering-for-production-mlops,machine learning data lifecycle in production ,"data science machine learning ml metadata,convolutional neural network,tensorflow extended (tfx),data validation,data transformation,"
https://www.coursera.org/learn/data-mining-project?specialization=data-mining,data mining project,"data science data analysis data clustering algorithms,data analysis,natural language processing,data mining,"
https://www.coursera.org/learn/business-writing?specialization=project-management-success,high-impact business writing,"business business essentials email writing,proofreading,writing,communication,business writing,"
https://www.coursera.org/learn/financialaccounting?specialization=accounting,what is financial accounting?,"business business essentials practical applications,financial statement,practical applications in accounting,accounting cycle,"
https://www.coursera.org/learn/managing-organization?specialization=strategic-leadership,managing the organization,"business leadership and management organizational culture,ethics,decision-making,strategic leadership,organizational change,"
https://www.coursera.org/learn/iot-cloud?specialization=uiuc-iot,iot cloud,"computer science mobile and web development internet,internet of things (iot),front and back ends,service discovery,"
https://www.coursera.org/learn/fpga-hardware-description-languages?specialization=fpga-design,hardware description languages for fpga design,"physical science and engineering electrical engineering writing code in verilog,simulating fpga designs,designing fpga logic,designing test benches,writing code in vhdl,"
https://www.coursera.org/learn/hardware-security?specialization=cyber-security,hardware security,"computer science computer security and networks montgomery modular multiplication,side-channel attack,hardware design,cryptographic hardware,"
https://www.coursera.org/learn/using-zoom-to-connect-with-learners?specialization=online-learning-design-educators,online teaching: using zoom to connect with learners ,"social sciences education video conferencing,virtual class,lesson plan,zoom,web conferencing,"
https://www.coursera.org/learn/understanding-user-needs?specialization=michiganux,understanding user needs,"computer science design and product user research,affinity diagram,human computer interaction,user experience (ux),"
https://www.coursera.org/learn/speaking-and-presenting-pitches-persuasion?specialization=good-with-words-speaking-and-presenting,speaking and presenting: pitches and persuasion,"personal development personal development problem solving,dynamic movement,resilience,optimism,ingenuity,"
https://www.coursera.org/learn/spatial-analysis-satellite-imagery-in-a-gis?specialization=gis-mapping-spatial-analysis,spatial analysis and satellite imagery in a gis,"physical science and engineering environmental science and sustainability geographic information system (gis),cartography,esri,mapping,spatial analysis,"
https://www.coursera.org/learn/product-management-essentials?specialization=product-ideation-design-and-management,product management essentials,"business business essentials customer development,product development,marketing,product management,leadership,"
