URL,Title,Description
https://www.coursera.org/professional-certificates/ibm-data-science,ibm data science professional certificate,"data science data analysis data science,deep learning,machine learning,big data,data mining,github,python programming,jupyter notebooks,rstudio,methodology,crisp-dm,data analysis,pandas,numpy,cloud databases,relational database management system (rdbms),sql,predictive modelling,data visualization (dataviz),model selection,dashboards and charts,dash,matplotlib,scipy and scikit-learn,regression,classification,hierarchical clustering,jupyter notebook,data science methodology,k-means clustering,"
https://www.coursera.org/professional-certificates/google-ux-design,google ux design professional certificate,"computer science design and product user experience (ux),ux research,wireframe,prototype,user experience design (uxd),usability testing,mockup,figma,adobe xd,ux design jobs,"
https://www.coursera.org/professional-certificates/google-it-support,google it support professional certificate,"information technology support and operations debugging,encryption algorithms and techniques,customer service,network protocols,cloud computing,"
https://www.coursera.org/professional-certificates/ibm-data-analyst,ibm data analyst professional certificate,"data science data analysis microsoft excel,python programming,data analysis,data visualization (dataviz),sql,"
https://www.coursera.org/professional-certificates/google-digital-marketing-ecommerce,google digital marketing & e-commerce professional certificate,"business marketing marketing,e-commerce,display advertising,email marketing,search engine optimization (seo),"
https://www.coursera.org/professional-certificates/devops-and-software-engineering,ibm devops and software engineering professional certificate,"computer science software development test-driven development,ci/cd,behavior-driven development,devops,cloud native,iaas paas saas,hybrid multicloud,cloud computing,agile software development,scrum methodology,zenhub,kanban,sprint planning,basic programming concepts,careers in software engineering,programming languages and frameworks,the software development lifecycle (sdlc),software architecture,shell script,bash (unix shell),linux,distributed version control (drcs),open source,version control systems,github,git (software),data science,python programming,data analysis,pandas,numpy,artificial intelligence (ai),web application,application development,flask,kubernetes,docker,containers,openshift,swagger,serverless,microservices,representational state transfer (rest),ibm code engine,test case,software testing,automated testing,continuous integration,continuous development,automation,infrastructure as code,open web application security project (owasp),observability,security,monitoring,logging,agile,"
https://www.coursera.org/professional-certificates/ibm-full-stack-cloud-developer,ibm full stack software developer professional certificate,"information technology cloud computing cloud native,devops,iaas paas saas,hybrid multicloud,cloud computing,cascading style sheets (css),html,git (software),javascript,cloud applications,distributed version control (drcs),open source,version control systems,github,web development,user interface,react (web framework),front-end development,back-end development,server-side javascript,express,computer science,data science,python programming,data analysis,pandas,numpy,artificial intelligence (ai),web application,application development,flask,django (web framework),database (dbms),sql,kubernetes,docker,containers,openshift,swagger,serverless,microservices,representational state transfer (rest),ibm code engine,node.js,"
https://www.coursera.org/professional-certificates/ibm-data-engineer,ibm data engineering professional certificate,"information technology data management relational database management syste (rdbms),etl & data pipelines,nosql and big data,apache spark,sql,"
https://www.coursera.org/professional-certificates/ibm-data-analyst-r-excel,ibm data analytics with excel and r professional certificate,"data science data analysis microsoft excel,relational databases (rdbms),r programming,data analysis,data visualization (dataviz),"
https://www.coursera.org/professional-certificates/ibm-cybersecurity-analyst,ibm cybersecurity analyst professional certificate,"information technology security information security analyst,it security analyst,security analyst,junior cybersecurity analyst,"
https://www.coursera.org/professional-certificates/google-advanced-data-analytics,google advanced data analytics professional certificate,"data science data analysis data science,regression models,predictive modelling,exploratory data analysis (eda),statistical analysis,machine learning,python programming,data analysis,jupyter notebook,tableau software,data visualization (dataviz),kaggle,"
https://www.coursera.org/professional-certificates/ibm-backend-development,ibm back-end development professional certificate,"computer science software development database (dbms),containers,python programming,microservices,backend development,"
https://www.coursera.org/professional-certificates/applied-artifical-intelligence-ibm-watson-ai,ibm applied ai professional certificate,"data science machine learning data science,deep learning,artificial intelligence (ai),jobs,machine learning,application programming interfaces (api),watson,python programming,data analysis,pandas,numpy,web application,application development,flask,artifical intelligence,watson ai,chatbot,"
https://www.coursera.org/professional-certificates/meta-front-end-developer,meta front-end developer professional certificate,"计算机科学 移动和网络开发 cascading style sheets (css),html,ui/ux design,react,javascript,"
https://www.coursera.org/professional-certificates/ibm-technical-support,ibm it support  professional certificate,"information technology support and operations networking/cybersecurity essentials,it fundamentals,hardware/software setup,technical support,cloud computing,"
https://www.coursera.org/professional-certificates/google-it-automation,google it automation with python professional certificate,"information technology support and operations using version control,troubleshooting & debugging,python programming,configuration management,automation,"
https://www.coursera.org/professional-certificates/data-warehouse-engineering,ibm data warehouse engineer professional certificate,"information technology data management data science,database (dbms),nosql,sql,database (db) design,database architecture,postgresql,mysql,relational database management system (rdbms),create, read, update and delete,data analysis,shell script,bash (unix shell),linux,database servers,relational database,database security,database administration,extraction, transformation and loading (etl),apache kafka,apache airflow,data pipelines,data warehousing,cube and rollup,business intelligence (bi),star and snowflake schema,cognos analytics,oltp databases,"
https://www.coursera.org/professional-certificates/ai-engineer,ibm ai engineering professional certificate,"data science machine learning scipy and scikit-learn,machine learning,regression,classification,hierarchical clustering,deep learning,artificial neural network,artificial intelligence (ai),keras,opencv,image processing,computer vision,"
https://www.coursera.org/professional-certificates/ibm-applied-devops-engineering,ibm applied devops engineering professional certificate,"computer science software development site reliability engineering (sre),devops engineering,kubernetes,agile methodologies,continuous integration and continuous deployment (ci/cd),"
https://www.coursera.org/professional-certificates/facebook-social-media-marketing,meta social media marketing professional certificate,"business marketing performance advertising,digital marketing,brand management,social media marketing,content marketing,"
https://www.coursera.org/professional-certificates/intuit-bookkeeping,intuit academy bookkeeping professional certificate,"business business essentials double-entry bookkeeping system,bookkeeping,bank reconciliations,accounting concepts and measurement,"
https://www.coursera.org/professional-certificates/tensorflow-in-practice,deeplearning.ai tensorflow developer professional certificate,"data science machine learning computer vision,convolutional neural network,machine learning,natural language processing,"
https://www.coursera.org/professional-certificates/meta-back-end-developer,meta back-end developer professional certificate,"computer science mobile and web development cloud hosting,application programming interfaces (api),python programming,computer programming,django (web framework),linux,web development,bash (unix shell),github,version control,mysql,database (dbms),database administration,build a data model,design a web application,debugging,authentication and authorization,rest apis,filtering and ordering,serializers and deserializers,cascading style sheets (css),html,production environments,javascript,api endpoints,pseudocode,algorithms,communication,data structure,computer science,"
https://www.coursera.org/professional-certificates/meta-ios-developer,meta ios developer professional certificate,"computer science mobile and web development ios app development,application development,mobile development,linux,web development,bash (unix shell),github,version control,swift programming,web design,front-end web development,user experience (ux),accessibility,use navigation in your apps,json,apis,core data,•	create simple javascript code,•	create and manipulate objects and arrays,•	write unit testing using jest,web application,react (web framework),react (javascript library),react,software architecture,ui development,data management,pseudocode,algorithms,communication,data structure,computer science,"
https://www.coursera.org/professional-certificates/google-business-intelligence,google business intelligence professional certificate,"data science data analysis data modeling,business analysis,bigquery,sheets,data analysis,extraction, transformation and loading (etl),business process,tableau software,data visualization (dataviz),business intelligence,sql,dashboarding and reporting,"
https://www.coursera.org/professional-certificates/meta-android-developer,meta android developer professional certificate,"computer science mobile and web development android studio,application development,mobile development,linux,web development,bash (unix shell),github,version control,create arrays,kotlin playground,create control flow patterns using conditionals and loops,practice using and extending protocols.,declare and initialize different types of variables,web design,front-end web development,user experience (ux),accessibility,use ui component libraries to build android ui,create a simple android ui,compose ui using kotlin ui views,build a simple ui using the layout editor,working with sqlite,rest api's,data and databases,•	create simple javascript code,•	create and manipulate objects and arrays,•	write unit testing using jest,web application,react (web framework),react (javascript library),react,kotlin,ux and ui,pseudocode,algorithms,communication,data structure,computer science,"
https://www.coursera.org/professional-certificates/meta-database-engineer,meta database engineer professional certificate,"information technology data management sql and python syntax,database management,database administration,mysql,tabular records,"
https://www.coursera.org/professional-certificates/analisis-de-datos-de-google,análisis de datos de google professional certificate,"ciencia de datos análisis de datos visualización de datos (dataviz),limpieza de datos,hoja de cálculo,análisis de datos,sql,cuestionamiento,resolución de problemas,toma de decisiones,recopilación de datos,metadatos,ética de datos,determinación del tamaño de la muestra,integridad de datos,cálculos en torno a los datos,agregación de datos,tableau software,presentación,programación en r,r markdown,rstudio,portfolio de trabajo,caso práctico,"
https://www.coursera.org/professional-certificates/sap-technology-consultant,sap technology consultant  professional certificate,"business leadership and management client engagement and communication,how to launch and develop your sap career,business and process analysis,solution design and implementation,understanding the sap world and solutions,"
https://www.coursera.org/professional-certificates/gestion-de-proyectos-de-google,gestión de proyectos de google professional certificate,"negocios liderazgo y gestión gestión de proyectos,cultura de la organización,pensamiento estratégico,desarrollo profesional,gestión de cambios,estatuto del proyecto,redacción de negocios,gestión de los interesados,gestión de riesgos,adquisiciones,planificación de proyectos,estimación de tareas,gestión de calidad,ejecución del proyecto,influencia,asesoramiento,resolución de problemas,gestión con la metodología agile,scrum,comunicación efectiva,"
https://www.coursera.org/professional-certificates/aws-cloud-solutions-architect,aws cloud solutions architect  professional certificate,"information technology cloud computing aws certification preparation,cloud architecture,architecting on aws,data lakes,aws management console,"
https://www.coursera.org/professional-certificates/arizona-state-university-tesol,arizona state university tesol professional certificate,"language learning learning english efl,english language,tesol,esl,english language teaching,"
https://www.coursera.org/professional-certificates/salesforce-sales-operations,salesforce sales operations professional certificate,"business business essentials crm,sales operations,salesforce lightning,sales,salesforce,"
https://www.coursera.org/professional-certificates/diseno-de-experiencia-del-usuario-ux-de-google,diseño de experiencia del usuario (ux) de google professional certificate,"ciencias de la computación diseño y producto experiencia del usuario (ux),esquema,diseño de la experiencia del usuario (uxd),investigación en ux,prototipo,esquema de página,pruebas de usabilidad,maqueta,figma,adobe xd,trabajos de diseño de ux,"
https://www.coursera.org/professional-certificates/preparing-for-google-cloud-machine-learning-engineer-professional-certificate,preparing for google cloud certification: machine learning engineer professional certificate,"information technology cloud computing google cloud,machine learning,feature engineering,tensorflow,cloud computing,"
https://www.coursera.org/professional-certificates/gcp-data-engineering,preparing for google cloud certification: cloud data engineer professional certificate,"data science machine learning information engineering,google cloud,bigquery,tensorflow,cloud computing,"
https://www.coursera.org/professional-certificates/gcp-cloud-architect,preparing for google cloud certification: cloud architect professional certificate,"information technology cloud computing google compute engine,google app engine (gae),google cloud platform,cloud computing,virtual machine,network architecture,debugging,cloud storage,data store,load balancing,virtual private network (vpn),autoscaling,disaster recovery,site reliability engineering,"
https://www.coursera.org/professional-certificates/analise-de-dados-do-google,google data analytics (pt) professional certificate,"data science data analysis visualização de dados (dataviz),limpeza de dados,planilha,sql,análise dos dados,análise de dados,questionamento,solução de problemas,tomada de decisões,metadados,ética em dados,coleta de dados,integridade dos dados,determinação do tamanho da amostra,cálculos de dados,agregação de dados,apresentação,software tableau,programação em r,r markdown,rstudio,estudo de caso,portfólio profissional,"
https://www.coursera.org/professional-certificates/cloud-engineering-gcp,preparing for google cloud certification: cloud engineer professional certificate,"information technology cloud computing google compute engine,google app engine (gae),google cloud platform,cloud computing,virtual machine,network architecture,debugging,cloud storage,data store,load balancing,virtual private network (vpn),autoscaling,google cloud,gcp infrastructure,gcp ace certification,"
https://www.coursera.org/professional-certificates/facebook-marketing-analytics,análise de marketing da meta professional certificate,"negócios marketing marketing strategy,data analysis,marketing mix optimization,statistics for marketing,advertising effectiveness evaluation,"
https://www.coursera.org/professional-certificates/sre-devops-engineer-google-cloud,preparing for google cloud certification: cloud devops engineer professional certificate,"information technology cloud computing google compute engine,google app engine (gae),google cloud platform,cloud computing,sre culture,business value,organizational culture,disaster recovery,site reliability engineering,continuous delivery,kubernetes,jenkins (software),"
https://www.coursera.org/professional-certificates/google-cloud-developer,preparing for google cloud certification: cloud developer professional certificate,"information technology cloud computing debugging,google cloud platform,cloud storage,application development,cloud computing,"
https://www.coursera.org/professional-certificates/google-cloud-security,preparing for google cloud certification: cloud security engineer professional certificate,"information technology cloud computing google compute engine,google app engine (gae),google cloud platform,cloud computing,create and understand custom iam roles,secure a kubernetes environment,create and configure network peering,"
https://www.coursera.org/professional-certificates/google-cloud-networking,preparing for google cloud certification: cloud network engineer professional certificate,"information technology cloud computing google compute engine,google app engine (gae),google cloud platform,cloud computing,"
https://www.coursera.org/professional-certificates/pwc-gst-taxation-executive,pwc gst taxation executive  professional certificate,"business finance e-invoicing & e-way bill,gst technical,gst compliances & return filing,gst law,registration & reconciliation,"
https://www.coursera.org/professional-certificates/sales-development-representative,salesforce sales development representative professional certificate,"business business essentials sales development,interviewing,sales,time management,cold calling,"
https://www.coursera.org/professional-certificates/sas-programming,sas programmer professional certificate,"data science data analysis sas studio,import data,reports,prepare data,sas programs,"
https://www.coursera.org/professional-certificates/ux-design-do-google,google ux design (pt) professional certificate,"computer science design and product pesquisa de ux,design de experiência do usuário (uxd),wireframe,prototipo,experiência do usuário (ux),testagem de usabilidade,maquete,figma,adobe xd,empregos em design de ux,"
https://www.coursera.org/professional-certificates/gestao-de-projetos-do-google,google project management (pt) professional certificate,"business leadership and management cultura organizacional,gestão de mudança,gerenciamento de projetos,desenvolvimento de carreira,pensamento estratégico,escrita de negócios,termo de abertura do projeto,compras,gestão de riscos,planejamento de projetos,estimativa de tarefas,gerenciamento da qualidade,gerenciamento de riscos,execução de projetos,coaching,influencia,gerenciamento agile,solução de problemas,scrum,comunicação eficaz,gerenciamento das partes interessadas,"
https://www.coursera.org/professional-certificates/azure-data-scientist,microsoft azure data scientist associate (dp-100)  professional certificate,"computer science software development manage azure resources for machine learning,deploy and operationalize machine learning solutions,run experiments and train models,implement responsible machine learning,"
https://www.coursera.org/professional-certificates/analytique-des-donnees-google,google data analytics professional certificate,"data science data analysis tableurs,visualisation des données (dataviz),sql,nettoyage des données,analyse de donnees,prise de décision,résolution de problèmes,questionnement,collecte de données,éthique des données,métadonnées,détermination de la taille d’échantillon,feuille de calcul,intégrité des données,analyse des données,agrégation des données,calculs de données,presentation,logiciel tableau,programmation r,r markdown,rstudio,portfolio pour la recherche d'emploi,étude de cas,"
https://www.coursera.org/professional-certificates/gestion-de-projet-google,google project management professional certificate,"business leadership and management gestion du changement,gestion de projets,réflexion stratégique,culture organisationnelle,perfectionnement professionnel,charte de projet,gestion de projet,gestion des parties prenantes,écriture commerciale,gestion des risques,planification de projet,approvisionnement,estimation de la tâche,exécution du projet,gestion de la qualité,coaching,gestion agile,influencer marketing,résolution de problèmes,scrum,gestion des partenaires,communication efficace,"
https://www.coursera.org/professional-certificates/data-analytics-japanese,google データアナリティクス professional certificate,"データサイエンス データ分析 ビジュアライゼーション,"
https://www.coursera.org/professional-certificates/tally-bookkeeper,tally bookkeeper professional certificate,"business finance bookkeeping,business accounting,tally prime,banking,finance,"
https://www.coursera.org/professional-certificates/google-data-analytics-arabic,تحليلات البيانات من google professional certificate,"data science data analysis دول البيانات,مؤثرات عرض البيانات (dataviz),تنظيف البيانات,sql,تحليل البيانات,طرح الأسئلة,جدول البيانات,عملية اتخاذ القرار,حل المشكلات,أخلاقيات البيانات,جمع البيانات,بيانات التعريف,سلامة البيانات,نظيف البيانات,تحديد حجم العينة,تجميع البيانات,العمليات الحسابية للبيانات,تحليلات البيانات,العرض التقديمي,برنامج tableau,r markdown,لغة البرمجة r,rstudio,محفظة الوظائف,دراسة الحالة,"
https://www.coursera.org/professional-certificates/sas-visual-business-analytics,sas visual business analytics professional certificate,"data science data analysis business analytics,sas va,sas visual analytics,"
https://www.coursera.org/professional-certificates/conception-ux-google,google ux design professional certificate,"computer science design and product maquette fonctionnelle,expérience utilisateur (ux),conception expérience utilisateur (uxd),prototype,recherche ux,armature,conception de l’expérience utilisateur (uxd),tests de la facilité d’utilisation,figma,maquette,adobe xd,test d’utilisabilité,test de facilité d’utilisation,emplois de conception ux.,"
https://www.coursera.org/professional-certificates/palo-alto-networks-cybersecurity-fundamentals,palo alto networks cybersecurity professional certificate,"information technology security managing and encrypting a zero-trust environment,deploying vpns and ssl/ssh encryption,analyzing firewall logs and configuring security controls,configuring network protection and dynamic routing using firewalls,mitigating vulnerabilities using packet capture and analysis,"
https://www.coursera.org/professional-certificates/google-it-de,google it support (deutsch)  professional certificate,"information technology support and operations debugging,customer service,network protocols,encryption algorithms,cloud computing,"
https://www.coursera.org/professional-certificates/support-informatique-google,google it support professional certificate,"information technology support and operations service client,débogage,cloud computing.,algorithmes et techniques de chiffrement,protocoles réseau,"
https://www.coursera.org/professional-certificates/google-project-management-de,google project management (de) professional certificate,"business leadership and management projektmanagement,strategisches denken,veränderungsmanagement,karriereentwicklung,organisationskultur,stakeholder-management,business writing,projektcharta,aufgabenschätzung,projektplanung,risikomanagement,beschaffung,projektabwicklung,qualitätsmanagement,•	problemlösung,•	scrum,•	agiles management,•	einflussnahme,•	coaching,problemlösung,effektive kommunikation,"
https://www.coursera.org/professional-certificates/marketing-en-redes-sociales-de-facebook,marketing en redes sociales de meta professional certificate,"business marketing publicidad de rendimiento,marketing en redes sociales,marketing digital,gestión de marcas,marketing de contenidos,"
https://www.coursera.org/professional-certificates/gcp-data-engineering-jp,preparing for google cloud certification: cloud data engineer professional certificate 日本語版 professional certificate,"data science machine learning tensorflow,bigquery,google cloud platform,cloud computing,"
https://www.coursera.org/professional-certificates/analitik-data-google,analitik data google professional certificate,"data science data analysis analisis data,visualisasi data (dataviz),pembersihan data,sql,aplikasi spreadsheet,spreadsheet,pengambilan keputusan,mengajukan pertanyaan,pemecahan masalah,pengumpulan data,metadata,etika data,sample size determination (penentuan ukuran sampel),data integrity (integritas data),data cleansing (pembersihan data),agregasi data,kalkulasi data,perangkat lunak tableau,presentasi,pemrograman r,r markdown,rstudio,studi kasus,portofolio kerja,"
