URL,Title,Description
https://www.coursera.org/learn/the-structured-query-language-sql?specialization=databases-for-data-scientists,the structured query language (sql),"data science data analysis data science,database (dbms),database application,sql (structured query language),database administration,"
https://www.coursera.org/learn/leading-teams-developing-as-a-leader?specialization=strategic-leadership,leading teams: developing as a leader,"business leadership and management self-awareness,ethical decision-making,defining leadership,trust in relationships,leadership development,"
https://www.coursera.org/learn/python-genomics?specialization=genomic-data-science,python for genomic data science,"data science data analysis bioinformatics,biopython,python programming,genomics,"
https://www.coursera.org/learn/javascript?specialization=web-design,interactivity with javascript,"computer science mobile and web development document object model (dom),javascript,web development,"
https://www.coursera.org/learn/data-science-fundamentals-for-data-analysts?specialization=data-science-with-databricks-for-data-analysts,data science fundamentals for data analysts,"data science probability and statistics data science,data analysis,machine learning,"
https://www.coursera.org/learn/sustainability-challenges-for-planet-and-employers?specialization=sustainability-analyst,sustainability challenges for the planet and employers,"physical science and engineering environmental science and sustainability business communication,professional development,problem solving,sustainability,"
https://www.coursera.org/learn/data-science-project?specialization=data-science-statistics-machine-learning,data science capstone,"data science data analysis data science,machine learning,r programming,natural language processing,"
https://www.coursera.org/learn/algorithmic-thinking-1?specialization=computer-fundamentals,algorithmic thinking (part 1),"computer science software development graph theory,algorithms,python programming,graph algorithms,"
https://www.coursera.org/learn/problem-solving?specialization=career-success,effective problem-solving and decision-making,"business business essentials decision theory,analysis,decision-making,problem solving,critical thinking,"
https://www.coursera.org/learn/navigate-music-industry-independent-artist?specialization=diy-musician,building your career in music: developing a brand and funding your music,"arts and humanities music and art music business,marketing,crowdfunding,social media,networking,"
https://www.coursera.org/learn/supply-chain-logistics?specialization=supply-chain-management,supply chain logistics,"business business essentials warehouse management,logistics planning,supply chain,inventory,"
https://www.coursera.org/learn/riesgos-cambios-proyectos?specialization=administracion-proyectos,programación y presupuesto del proyecto,"business leadership and management microsoft project,cost,management,project planning,"
https://www.coursera.org/learn/introduction-to-nosql-databases?specialization=nosql-big-data-and-spark-foundations,introduction to nosql databases,"information technology data management mongodb,nosql,cloud database,cloudant,cassandra,"
https://www.coursera.org/learn/google-chat?specialization=getting-started-with-google-workspace,google chat,"information technology cloud computing communication,spreadsheet software,collaboration,"
https://www.coursera.org/learn/future-developments-supply-chain-finance-blockchain-technology?specialization=supply-chain-finance-and-blockchain-technology,future development in supply chain finance and blockchain technology,"business finance financial innovation,blockchain implementation in supply chain finance,apis for trade finance,managing accounts receivable and accounts payable with blockchain,"
https://www.coursera.org/learn/quantitative-research?specialization=market-research,quantitative research,"business marketing sales and operations planning,market research,sample mean and covariance,basic statistics,sampling statistics,"
https://www.coursera.org/learn/protools?specialization=diy-musician,pro tools basics,"arts and humanities music and art music,music production,midi,pro tools,music recording,"
https://www.coursera.org/learn/3-axis-machining-autodesk-fusion-360?specialization=autodesk-cad-cam-manufacturing,3-axis machining with autodesk fusion 360,"physical science and engineering mechanical engineering manufacturing process management,computer-aided design (cad),computer-aided manufacturing,autodesk fusion 360,mechanical engineering,"
https://www.coursera.org/learn/infonomics-1?specialization=business-data-management-communication,infonomics i: business information economics and data monetization,"business business essentials strategy,accounting,data analysis,big data,innovation,"
https://www.coursera.org/learn/mechanical-engineering-design-manufacturing?specialization=autodesk-cad-cam-cae-mechanical-engineering,introduction to mechanical engineering design and manufacturing with fusion 360,"physical science and engineering mechanical engineering autodesk,manufacturing process management,engineering,fusion 360,mechanical engineering,"
https://www.coursera.org/learn/emergency-care-pregnancy-infants-children?specialization=become-an-emt,"emergency care: pregnancy, infants, and children","health patient care infant,ingestion,listening,emergency,"
https://www.coursera.org/learn/probabilistic-graphical-models-2-inference?specialization=probabilistic-graphical-models,probabilistic graphical models 2: inference,"data science machine learning inference,gibbs sampling,markov chain monte carlo (mcmc),belief propagation,"
https://www.coursera.org/learn/fundamentals-of-reinforcement-learning?specialization=reinforcement-learning,fundamentals of reinforcement learning,"data science machine learning artificial intelligence (ai),machine learning,reinforcement learning,function approximation,intelligent systems,"
https://www.coursera.org/learn/python-plotting?specialization=data-science-python,"applied plotting, charting & data representation in python","data science data analysis python programming,data virtualization,data visualization (dataviz),matplotlib,"
https://www.coursera.org/learn/songwriting-lyrics?specialization=diy-musician,songwriting: writing the lyrics,"arts and humanities music and art music,music recording,poetry,songwriting,"
https://www.coursera.org/learn/six-sigma-analyze?specialization=six-sigma-fundamentals,six sigma tools for analyze,"business business essentials statistics,binomial distribution,data analysis,causality,"
https://www.coursera.org/learn/copyright-law-music-business?specialization=business-music-production,copyright law in the music business,"business business strategy create music legally,read legal documents,leverage the copyright law to your advantage,write a co-writing agreement,"
https://www.coursera.org/learn/health-impacts-chemicals-consumer-products?specialization=healthy-sustainable-foods-products,health impacts of chemicals in consumer products,"health public health motivation,performance,disease,flow network,"
https://www.coursera.org/learn/app-deployment-debugging-performance?specialization=developing-apps-gcp,"app deployment, debugging, and performance","computer science software development application deployment,debugging,google cloud,cloud computing,execution environments,"
https://www.coursera.org/learn/decentralized-finance-opportunities-and-risk-duke?specialization=decentralized-finance-duke,decentralized finance (defi) opportunities and risks,"business finance understanding smart contract risk,different approaches to custody,ethereum 2.0 approaches to scaling,mechanics and risks of decentralized exchange,assessing regulatory risk,"
https://www.coursera.org/learn/business-analytics-decision-making?specialization=data-analytics-business,business analytics for decision making,"data science data analysis data analysis,simulation,business analytics,mathematical optimization,"
https://www.coursera.org/learn/professional-emails-english?specialization=improve-english,write professional emails in english,"language learning learning english professional,email writing,communication,writing,"
https://www.coursera.org/learn/ml-pipelines-bert?specialization=practical-data-science," build, train, and deploy ml pipelines using bert","data science machine learning ml pipelines and mlops,model training and deployment with bert,model debugging and evaluation,feature engineering and feature store,artifact and lineage tracking,"
https://www.coursera.org/learn/data-visualization-r?specialization=applied-data-science-r,data visualization with r,"data science data analysis data science,data analysis,data visualization (dataviz),r programming,"
https://www.coursera.org/learn/road-to-ciso?specialization=managing-cybersecurity,road to the ciso – culminating project course,"information technology security cyber-security regulation,cybersecurity staffing,risk management,contingency plan,cybersecurity governance,"
https://www.coursera.org/learn/ableton-live?specialization=electronic-music-production,introduction to ableton live,"arts and humanities music and art audio recording,music making,file management,ableton,midi programming,"
https://www.coursera.org/learn/managing-processes?specialization=value-based-care,value-based care: managing processes to improve outcomes,"health patient care health education,value-based healthcare,patient care,public health,office processes,"
https://www.coursera.org/learn/developing-innovative-ideas-for-product-leaders?specialization=product-ideation-design-and-management,developing innovative ideas for product leaders,"business leadership and management market analysis,ideation,entrepreneurship,innovation,competitive analysis,"
https://www.coursera.org/learn/operational-risk-management?specialization=risk-management,operational risk management: frameworks & strategies,"business finance understand operational risk key risk indicators (kris),understand operational risk scenario analysis,calculate operational risk capital,"
https://www.coursera.org/learn/branding-and-cx?specialization=branding-the-creative-journey,branding and customer experience,"business marketing employment,leadership,management,customer experience,"
https://www.coursera.org/learn/guitar-performance?specialization=play-guitar,guitar performance techniques,"arts and humanities music and art music,ear training,performance techniques,guitar chords,guitar,"
https://www.coursera.org/learn/python-data-visualization?specialization=python,"capstone: retrieving, processing, and visualizing data with python","data science data analysis data analysis,python programming,database (dbms),data visualization (dataviz),"
https://www.coursera.org/learn/demand-analytics?specialization=supply-chain-analytics,demand analytics,"business business essentials model selection validation improvement,regression analysis,demand planning and forecasting,data visualization (dataviz),marketing analytics,"
https://www.coursera.org/learn/getting-a-consulting-job?specialization=managementconsulting,getting a consulting job,"business business strategy management consulting,case interview,interviewing,consulting,project management,"
https://www.coursera.org/learn/uva-darden-getting-started-agile?specialization=uva-darden-digital-product-management,agile meets design thinking,"computer science design and product agile user stories,user experience design (uxd),agile software development,product management,software development,"
https://www.coursera.org/learn/financial-accounting-advanced?specialization=business-value-project-management,financial accounting: advanced topics,"business finance cash flow,financial accounting,cash flow statement,financial statement,"
https://www.coursera.org/learn/python-databases?specialization=python,using databases with python,"computer science software development python programming,database (dbms),sqlite,sql,"
https://www.coursera.org/learn/introduction-to-parallel-programming-with-cuda?specialization=gpu-programming,introduction to parallel programming with cuda,"computer science software development cuda,algorithms,c/c++,gpu,nvidia,"
https://www.coursera.org/learn/digital-leadership-digital-strategy-execution?specialization=digital-marketing-strategy-planning,digital leadership and digital strategy execution,"business marketing strategic thinking,strategy execution,digital leadership,communicating results,customer experience (cx) design,"
https://www.coursera.org/learn/client-needs-and-software-requirements?specialization=product-management,client needs and software requirements ,"computer science design and product agile software development,user story,software requirements,use case,"
https://www.coursera.org/learn/portfolio-risk-management?specialization=investment-management,portfolio and risk management,"business finance portfolio theories,risk management,value at risk (var),portfolio optimization,"
https://www.coursera.org/learn/gcp-big-data-ml-fundamentals-jp?specialization=gcp-data-machine-learning-jp,google cloud big data and machine learning fundamentals 日本語版,"data science machine learning tensorflow,bigquery,google cloud platform,cloud computing,"
https://www.coursera.org/learn/text-retrieval?specialization=data-mining,text retrieval and search engines,"data science data analysis information retrieval (ir),document retrieval,machine learning,recommender systems,"
https://www.coursera.org/learn/machine-learning-trading-finance?specialization=machine-learning-trading,using machine learning in trading and finance,"data science machine learning algorithmic trading,python programming,machine learning,"
https://www.coursera.org/learn/wharton-global-trends-business?specialization=wharton-global-business-strategy,global trends for business and society,"social sciences governance and society global financial crisis,trend analysis,economy,trading,strategic management,"
https://www.coursera.org/learn/art-science-ml?specialization=machine-learning-tensorflow-gcp,machine learning in the enterprise,"data science machine learning tensorflow,machine learning,cloud computing,"
https://www.coursera.org/learn/text-mining?specialization=data-mining,text mining and analytics,"data science data analysis data clustering algorithms,text mining,probabilistic models,sentiment analysis,"
https://www.coursera.org/learn/designexperiments?specialization=interaction-design,"designing, running, and analyzing experiments","computer science design and product experiment,experimental design,statistical model,r programming,statistics,"
https://www.coursera.org/learn/crypto-finance?specialization=financialtechnology,blockchain and cryptocurrency explained,"business finance cryptocurrency,decentralization algorithms,consensus algorithms,blockchain,blockchain as a business solution,"
https://www.coursera.org/learn/device-based-models-tensorflow?specialization=tensorflow-data-and-deployment,device-based models with tensorflow lite,"computer science software development tensorflow lite,mathematical optimization,machine learning,tensorflow,object detection,"
https://www.coursera.org/learn/ai-for-medical-prognosis?specialization=ai-for-medicine,ai for medical prognosis ,"data science machine learning deep learning,machine learning,time-to-event modeling,random forest,model tuning,"
https://www.coursera.org/learn/organisational-design-know-your-organisation?specialization=hr-management-leadership,organisational design: know your organisation,"business leadership and management value chain,organisational leadership,organisational alignment,change planning,"
https://www.coursera.org/learn/ibm-penetration-testing-incident-response-forensics?specialization=security-analyst-fundamentals,"penetration testing, incident response and forensics","information technology security scripting,forensics,penetration test,cybersecurity,computer security incident management,"
https://www.coursera.org/learn/epidemiology-surveillance-systems?specialization=professional-epidemiology,surveillance systems: the building blocks,"health public health data collection,epidemiology,surveillance,disease surveillance,"
https://www.coursera.org/learn/clinical-trials-management-and-advanced-operations?specialization=clinical-trials-operations,clinical trials management and advanced operations,"health public health ethics,reproducibility,meta-analysis,compliance,evidence synthesis,"
https://www.coursera.org/learn/codio-cpp-basics?specialization=hands-on-cpp,c++ basics: selection and iteration,"computer science software development iteration,variables,c++,computer science,conditionals,"
https://www.coursera.org/learn/decentralized-finance-deep-dive-duke?specialization=decentralized-finance-duke,decentralized finance (defi) deep dive,"business finance set protocol’s tokenization method,mechanics of compound and aave,dydx’s derivatives implementation,proficiency with makerdao,constant function automated market makers,"
https://www.coursera.org/learn/machine-learning-foundations-for-product-managers?specialization=ai-product-management-duke,machine learning foundations for product managers,"data science machine learning data science,artificial neural network,machine learning,predictive analytics,modeling,"
https://www.coursera.org/learn/ibm-unsupervised-machine-learning?specialization=ibm-intro-machine-learning, unsupervised machine learning,"data science machine learning dimensionality reduction,unsupervised learning,cluster analysis,k means clustering,principal component analysis (pca),"
https://www.coursera.org/learn/data-science-project?specialization=jhu-data-science,data science capstone,"data science data analysis data science,machine learning,r programming,natural language processing,"
https://www.coursera.org/learn/strategy-implementation?specialization=strategic-management,strategy implementation,"business business strategy strategic management,strategy implementation,performance management,strategic planning,"
https://www.coursera.org/learn/wharton-risk-models?specialization=wharton-business-financial-modeling,modeling risk and realities,"business business essentials modeling,risk,microsoft excel,simulation,"
https://www.coursera.org/learn/immunology-innate-immune-system?specialization=immunology-the-immune-system-and-its-failures,immunology: innate immune system,"health basic science immunology,tumour immunity,autoimmunity,infectious diseases,"
https://www.coursera.org/learn/interaction-design-capstone?specialization=interaction-design,interaction design capstone project,"computer science design and product usability testing,user research,user experience (ux),user interface,"
https://www.coursera.org/learn/video-game-story?specialization=game-design,story and narrative development for video games,"arts and humanities music and art interactive storytelling,video game development,video game design,game design,"
https://www.coursera.org/learn/securing-integrating-components-app?specialization=developing-apps-gcp,securing and integrating components of your application,"computer science software development application programming interfaces (api),cloud functions,identity management (idm),cloud endpoints,publish–subscribe pattern,"
https://www.coursera.org/learn/algorithms-on-strings?specialization=data-structures-algorithms,algorithms on strings,"computer science algorithms suffix tree,suffix array,knuth–morris–pratt (kmp) algorithm,algorithms on strings,"
https://www.coursera.org/learn/ideal-gases?specialization=statistical-thermodynamics-engineering,ideal gases,"physical science and engineering mechanical engineering mechanical engineering,chemistry,thermodynamics,gases,"
https://www.coursera.org/learn/develop-your-musicianship?specialization=musicianship-specialization,developing your musicianship,"arts and humanities music and art aurally identify chords,piano,read lead sheets,aurally identify musical intervals,read music notation,"
https://www.coursera.org/learn/music-business-foundations?specialization=business-music-production,music business foundations,"arts and humanities music and art music business,revenue streams,teambuilding,copyright,contracts,"
https://www.coursera.org/learn/businessintelligence?specialization=supply-chain-analytics,business intelligence and competitive analysis,"business business essentials management consulting,benchmarking,data analysis,business intelligence,competitive analysis,"
https://www.coursera.org/learn/contemporary-art?specialization=modern-contemporary-art-design,what is contemporary art?,"arts and humanities music and art creativity,art,history,museums,art history,"
https://www.coursera.org/learn/influencing-people?specialization=leading-teams,influencing people,"business business essentials leadership,management,social skills,influencer marketing,"
https://www.coursera.org/learn/creativity-entrepreneurship?specialization=music-business,creativity and entrepreneurship ,"business leadership and management rapid prototyping,hone observation skills,presentation skills,teambuilding,"
https://www.coursera.org/learn/object-oriented-design?specialization=software-design-architecture,object-oriented design,"computer science software development object-oriented design,object-oriented analysis and design,unified modeling language (uml),"
https://www.coursera.org/learn/c-programming-language-foundations?specialization=c-programming-linux,c programming: language foundations - 2,"computer science software development computer programming,c programming,"
https://www.coursera.org/learn/deploying-machine-learning-models-in-production?specialization=machine-learning-engineering-for-production-mlops,deploying machine learning models in production,"data science machine learning tensorflow serving,model monitoring,model registries,machine learning operations (mlops),generate data protection regulation (gdpr),"
https://www.coursera.org/learn/artificial-intelligence-microsoft-azure?specialization=microsoft-azure-ai-900-ai-fundamentals,artificial intelligence on microsoft azure,"information technology cloud computing artificial intelligence (ai),microsoft azure,"
https://www.coursera.org/learn/excel-data-visualization?specialization=excel-data-analytics-visualization,data visualization in excel,"business business essentials microsoft excel,data visualization (dataviz),"
https://www.coursera.org/learn/web-design-project?specialization=web-design,web design for everybody capstone,"computer science mobile and web development web design,html,javascript,cascading style sheets (css),"
https://www.coursera.org/learn/protools?specialization=music-production,pro tools basics,"arts and humanities music and art music,music production,midi,pro tools,music recording,"
https://www.coursera.org/learn/analytics-excel?specialization=excel-mysql,mastering data analysis in excel,"data science data analysis binary classification,data analysis,microsoft excel,linear regression,"
https://www.coursera.org/learn/consulting-problem-solving?specialization=managementconsulting,consulting approach to problem solving,"business business strategy management consulting,problem solving,data analysis,consulting,lean six sigma,"
https://www.coursera.org/learn/linux-kernel-programming-yocto-project?specialization=advanced-embedded-linux-development,linux kernel programming and introduction to yocto project,"computer science software development shell script,c programming,linux,embedded systems,"
https://www.coursera.org/learn/adjective-clauses?specialization=intermediate-grammar,adjectives and adjective clauses,"language learning learning english apposition,grammar,english language,adjective,"
https://www.coursera.org/learn/mindfulness-integrative-healthcare?specialization=integrative-health-and-medicine,mindfulness in integrative healthcare,"health research wellbeing,improved symptom management,whole-person care,mindfulness,integrative medicine,"
https://www.coursera.org/learn/trading-algorithm?specialization=trading-strategy,trading algorithms,"business finance trading strategy,post-earnings-announcement drift (pead),f1 score,trading,"
https://www.coursera.org/learn/supply-chain-finance-market-fintech-ecosystem?specialization=supply-chain-finance-and-blockchain-technology,supply chain finance market and fintech ecosystem,"business finance marketing supply chain finance services,risk management of supply chain finance,"
https://www.coursera.org/learn/perfect-tenses-modals?specialization=intermediate-grammar,perfect tenses and modals,"language learning learning english english grammar,grammar,perfect tenses,writing,"
https://www.coursera.org/learn/introduction-to-financial-analysis-the-why?specialization=financial-analysis-skills-for-success,"introduction to financial analysis - the ""why?""","business business essentials risk,financial analysis,financial statement,accounting,finance,"
https://www.coursera.org/learn/communication-in-the-workplace?specialization=career-success,communication in the 21st century workplace,"business business essentials business communication,communication,communications management,"
https://www.coursera.org/learn/principles-of-ux-ui-design?specialization=meta-react-native,principles of ux/ui design,"computer science mobile and web development web design,front-end web development,user experience (ux),accessibility,"
https://www.coursera.org/learn/edi-performance-techniques?specialization=electronic-music-production,electronic music performance techniques,"arts and humanities music and art electronic digital instrument,live looping,music,performance technique,music arrangement,"
https://www.coursera.org/learn/basic-statistics?specialization=social-science,basic statistics,"data science probability and statistics statistics,confidence interval,statistical hypothesis testing,r programming,"
